Title,Time,Link,Medscape Link,Teaser,Image URL,Content Type
Abnormal HR Shifts Tied to Risk for Death in Diabetes,2024-09-09 18:00:00,http://medscape.com/viewarticle/abnormal-heart-rate-shifts-tied-risk-death-diabetes-2024a1000g8n,https://www.medscape.com/viewarticle/abnormal-heart-rate-shifts-tied-risk-death-diabetes-2024a1000g8n,"A reduction in 24-hour heart rate variations was linked to twice the risk for long-term cardiovascular death, while the inability to reduce heart rate during sleep was linked to 39% increased risk.",https://img.medscapestatic.com/vim/live/professional_assets/medscape/thumbnail_library/dt_240909_heart_rate_graph_800x450.jpg,Clinical Summary
AI-Based Breast Cancer Screening Will Save Lives & Money,2024-09-09 09:00:00,https://jamanetwork.com/journals/jamanetworkopen/fullarticle/10.1001/jamanetworkopen.2024.31715?guestAccessKey=5fccf768-e956-418c-863e-a26f2d537653&utm_source=for_the_media&utm_medium=referral&utm_campaign=ftm_links&utm_content=tfl&utm_term=090524,https://www.medscape.co.uk/viewarticle/ai-based-breast-cancer-screening-found-cost-effective-nhs-2024a1000g49,"Most benefit is from risk-stratified screening, with annual screening for high-risk individuals to every 6 years for those at lowest risk.",https://img.medscapestatic.com/vim/live/professional_assets/medscape/news/2014/wc_140512_mammography_system_800x600.jpg,Clinical Summary
Demographics Linked to Worse Access to Cardiac Surgery,2024-09-09 09:00:00,http://medscape.co.uk/viewarticle/demographics-linked-worse-access-cardiac-surgery-2024a1000g4z,https://www.medscape.co.uk/viewarticle/demographics-linked-worse-access-cardiac-surgery-2024a1000g4z,"Women, Black people, and poor people were less likely to undergo major heart surgery.",https://img.medscapestatic.com/vim/live/professional_assets/medscape/images/thumbnail_library/gty_220429_sedation_poc_800x450.jpg,Clinical Summary
Monthly Semaglutide Goal: The End of Daily Pills?,2024-09-09 03:26:09,http://medscape.com/viewarticle/monthly-semaglutide-goal-end-daily-pills-2024a1000g7u,https://www.medscape.com/viewarticle/monthly-semaglutide-goal-end-daily-pills-2024a1000g7u,"An injectable hydrogel provided a sustained release of semaglutide for 1 month in rats, according to preclinical testing of an experimental longer-acting formulation.",https://img.medscapestatic.com/vim/live/professional_assets/medscape/thumbnail_library/dt_240909_hydrogel_balls_800x450.jpg,Clinical Summary
Join Dr Julie Oliver and the Primary Care Women’s Health Forum at Guidelines Live 2024,2024-09-09 02:59:00,http://medscape.co.uk/viewarticle/join-dr-julie-oliver-and-primary-care-womens-health-forum-2024a1000fb0,https://www.medscape.co.uk/viewarticle/join-dr-julie-oliver-and-primary-care-womens-health-forum-2024a1000fb0,"In anticipation of Guidelines Live 2024, the PCWHF provides a taster of its sessions in the Women’s Health Stream, which will address key issues around menopause and HRT",,Guidelines in Practice
Rheumatoid Arthritis: Whole-Food Diet May Be Protective,2024-09-06 10:00:00,http://medscape.co.uk/viewarticle/rheumatoid-arthritis-whole-food-diet-may-be-protective-2024a1000g29,https://www.medscape.co.uk/viewarticle/rheumatoid-arthritis-whole-food-diet-may-be-protective-2024a1000g29,"The more ultra-processed foods a person consumed, the higher their risk for the inflammatory autoimmune disease.",https://img.medscapestatic.com/vim/live/professional_assets/medscape/images/thumbnail_library/gty_221007_mediterranean_diet_800x450.jpg,Clinical Summary
Bariatric Surgery Before Pregnancy Tied to Premature Infants,2024-09-06 09:06:27,http://medscape.com/viewarticle/weight-loss-surgery-before-pregnancy-tied-smaller-and-2024a1000g64,https://www.medscape.com/viewarticle/weight-loss-surgery-before-pregnancy-tied-smaller-and-2024a1000g64,Bariatric surgery before pregnancy was associated with a higher risk for premature and small for gestational age infants.,https://img.medscapestatic.com/vim/live/professional_assets/medscape/images/thumbnail_library/gty_240905_pregnant_african_woman_800x450.jpg,Clinical Summary
GP Respiratory Consults Overcome Perfect Storm,2024-09-06 09:00:00,http://medscape.co.uk/viewarticle/gp-respiratory-consults-overcome-perfect-storm-2024a1000g0q,https://www.medscape.co.uk/viewarticle/gp-respiratory-consults-overcome-perfect-storm-2024a1000g0q,"As GP consults for respiratory tract infections increased, antibiotic prescriptions declined.",https://img.medscapestatic.com/vim/live/professional_assets/medscape/images/thumbnail_library/gty_240521_primary_care_physician_doctor_patient_800x450.jpg,Clinical Summary
"High Temperatures Also Exacerbate Raynaud, Study Suggests",2024-09-06 06:10:13,https://www.thelancet.com/journals/lanrhe/article/PIIS2665-9913/(24/)00189-9/abstract,https://www.medscape.com/viewarticle/high-temperatures-also-exacerbate-raynaud-study-suggests-2024a1000g5j,Both extreme heat and cold were tied to more severe episodes of Raynaud phenomenon in a study of participants with systemic sclerosis.,https://img.medscapestatic.com/vim/live/professional_assets/medscape/images/thumbnail_library/ps_240905_raynauds_phenomenon_800x450.jpg,Clinical Summary
